{
  "version": 1,
  "generated_at": "2026-06-13T00:00:00Z",
  "model_id": "claude-opus-4-8[1m]",
  "repository": "OWASP Juice Shop",
  "requirements_source": "demo",
  "catalog": {
    "description": "Generic baseline using public OWASP references. Customize by setting requirements_yaml_url in config.json to point to your organization's requirements.",
    "generated": "2026-04-07T00:00:00Z",
    "url": null,
    "count": 64
  },
  "filter": null,
  "demo": true,
  "priority_floor": "MUST",
  "summary": {
    "total": 64,
    "pass": 5,
    "partial": 8,
    "fail": 28,
    "unverifiable": 10,
    "not_applicable": 13
  },
  "results": [
    {
      "id": "WEB-001",
      "category": "CAT-WEB",
      "category_title": "Web & Frontend Security",
      "priority": "MUST",
      "status": "FAIL",
      "in_scope": true,
      "requirement_text": "Implement Anti-CSRF protection (e.g. via SameSite cookies) for user sessions. State-changing actions MUST NOT be performed via HTTP GET",
      "title": "Missing Anti-CSRF Controls",
      "evidence": [
        {
          "file": "server.ts",
          "line": 182
        }
      ],
      "finding": "no SameSite cookie attribute or CSRF token enforcement; CORS is wide-open at server.ts:182",
      "risk": "cross-site request forgery against authenticated state-changing endpoints",
      "fix": "Set SameSite=Strict/Lax on the session cookie and add CSRF tokens, keeping state changes off HTTP GET.",
      "effort": "M",
      "url": "https://cheatsheetseries.owasp.org/cheatsheets/Cross-Site_Request_Forgery_Prevention_Cheat_Sheet.html",
      "blueprint": {
        "id": "BP-SPA-BFF",
        "section": "CSRF Protection",
        "url": "https://cheatsheetseries.owasp.org/cheatsheets/Cross-Site_Request_Forgery_Prevention_Cheat_Sheet.html"
      }
    },
    {
      "id": "WEB-002",
      "category": "CAT-WEB",
      "category_title": "Web & Frontend Security",
      "priority": "MUST",
      "status": "FAIL",
      "in_scope": true,
      "requirement_text": "Do not store sensitive data in any client-side storage mechanism (localStorage, sessionStorage, IndexedDB, cookies without HttpOnly)",
      "title": "Session Token In localStorage",
      "evidence": [
        {
          "file": "frontend/src/app/app.guard.ts",
          "line": 18
        },
        {
          "file": "frontend/src/app/app.guard.ts",
          "line": 35
        }
      ],
      "finding": "JWT auth token persisted in localStorage at frontend/src/app/app.guard.ts:18,35",
      "risk": "any XSS payload can exfiltrate the bearer token; no HttpOnly protection",
      "fix": "Move the session into an HttpOnly, Secure, SameSite cookie via a BFF; keep it out of web storage.",
      "effort": "M",
      "url": "https://cheatsheetseries.owasp.org/cheatsheets/HTML5_Security_Cheat_Sheet.html",
      "blueprint": {
        "id": "BP-SPA-BFF",
        "section": "Browser Storage",
        "url": "https://cheatsheetseries.owasp.org/cheatsheets/HTML5_Security_Cheat_Sheet.html"
      }
    },
    {
      "id": "WEB-003",
      "category": "CAT-WEB",
      "category_title": "Web & Frontend Security",
      "priority": "MUST",
      "status": "FAIL",
      "in_scope": true,
      "requirement_text": "Configure CORS restrictively; use an explicit allowlist of trusted origins and never use wildcard (*) for authenticated APIs",
      "title": "Wildcard CORS",
      "evidence": [
        {
          "file": "server.ts",
          "line": 181
        },
        {
          "file": "server.ts",
          "line": 182
        }
      ],
      "finding": "app.use(cors()) with no origin allowlist at server.ts:182; comment labels it 'Allow everything!'",
      "risk": "any origin can issue credentialed cross-origin requests to the API",
      "fix": "Configure an explicit cors({ origin: <allowlist> }); never wildcard for authenticated APIs.",
      "effort": "S",
      "url": "https://cheatsheetseries.owasp.org/cheatsheets/CORS_Security_Cheat_Sheet.html",
      "blueprint": {
        "id": "BP-API-CORS",
        "section": "Overview",
        "url": "https://cheatsheetseries.owasp.org/cheatsheets/CORS_Security_Cheat_Sheet.html"
      }
    },
    {
      "id": "WEB-004",
      "category": "CAT-WEB",
      "category_title": "Web & Frontend Security",
      "priority": "SHOULD",
      "status": "FAIL",
      "in_scope": true,
      "requirement_text": "Activate Content-Security-Policy (CSP) headers on all internet-facing applications; avoid unsafe-inline and unsafe-eval directives",
      "title": "No Content Security Policy",
      "evidence": [
        {
          "file": "server.ts",
          "line": 185
        }
      ],
      "finding": "helmet.contentSecurityPolicy() not configured; no CSP meta in frontend/src/index.html",
      "risk": "no defense-in-depth against injected script execution",
      "fix": "Add a restrictive helmet.contentSecurityPolicy({ directives }) without unsafe-inline/unsafe-eval.",
      "effort": "M",
      "url": "https://cheatsheetseries.owasp.org/cheatsheets/Content_Security_Policy_Cheat_Sheet.html",
      "blueprint": {
        "id": "BP-SPA-BFF",
        "section": "Recommended CSP",
        "url": "https://cheatsheetseries.owasp.org/cheatsheets/Content_Security_Policy_Cheat_Sheet.html"
      }
    },
    {
      "id": "WEB-005",
      "category": "CAT-WEB",
      "category_title": "Web & Frontend Security",
      "priority": "MUST",
      "status": "FAIL",
      "in_scope": true,
      "requirement_text": "Set the Strict-Transport-Security (HSTS) response header on all internet-facing services with a minimum max-age of one year",
      "title": "Missing HSTS Header",
      "evidence": [
        {
          "file": "server.ts",
          "line": 185
        }
      ],
      "finding": "helmet supplies noSniff/frameguard but helmet.hsts() is never applied (server.ts:185-188)",
      "risk": "no browser HTTPS enforcement; vulnerable to SSL-strip downgrade",
      "fix": "Add app.use(helmet.hsts({ maxAge: 31536000, includeSubDomains: true })) (min one year).",
      "effort": "S",
      "url": "https://cheatsheetseries.owasp.org/cheatsheets/HTTP_Strict_Transport_Security_Cheat_Sheet.html",
      "blueprint": {
        "id": "BP-SPA-BFF",
        "section": "HSTS Header",
        "url": "https://cheatsheetseries.owasp.org/cheatsheets/HTTP_Strict_Transport_Security_Cheat_Sheet.html"
      }
    },
    {
      "id": "WEB-006",
      "category": "CAT-WEB",
      "category_title": "Web & Frontend Security",
      "priority": "MUST",
      "status": "PASS",
      "in_scope": true,
      "requirement_text": "Use only mature, actively maintained frontend frameworks; enable strict TypeScript mode and production build hardening",
      "title": "Mature Frontend Framework",
      "evidence": [],
      "finding": "uses Angular (mature, maintained) with TypeScript strict mode",
      "url": "https://cheatsheetseries.owasp.org/cheatsheets/Third_Party_Javascript_Management_Cheat_Sheet.html",
      "blueprint": {
        "id": "BP-SPA-BFF",
        "section": "Frontend Framework",
        "url": "https://cheatsheetseries.owasp.org/cheatsheets/Third_Party_Javascript_Management_Cheat_Sheet.html"
      }
    },
    {
      "id": "WEB-007",
      "category": "CAT-WEB",
      "category_title": "Web & Frontend Security",
      "priority": "MUST",
      "status": "FAIL",
      "in_scope": true,
      "requirement_text": "Encode all user-controlled output at the frontend to prevent Cross-Site Scripting (XSS); use framework-native binding rather than raw innerHTML",
      "title": "Unsafe HTML Sink Bypass",
      "evidence": [
        {
          "file": "frontend/src/app/administration/administration.component.ts",
          "line": 60
        },
        {
          "file": "frontend/src/app/track-result/track-result.component.ts",
          "line": 48
        }
      ],
      "finding": "bypassSecurityTrustHtml() applied to user-controlled values at administration.component.ts:60,78 and track-result.component.ts:48",
      "risk": "stored/reflected XSS \u2014 Angular's sanitizer is explicitly bypassed",
      "fix": "Remove bypassSecurityTrust* and use framework-native interpolation binding, per the XSS Prevention cheat sheet.",
      "effort": "M",
      "url": "https://cheatsheetseries.owasp.org/cheatsheets/Cross_Site_Scripting_Prevention_Cheat_Sheet.html",
      "blueprint": {
        "id": "BP-SPA-BFF",
        "section": "Trusted Types (TT)",
        "url": "https://cheatsheetseries.owasp.org/cheatsheets/Content_Security_Policy_Cheat_Sheet.html"
      }
    },
    {
      "id": "WEB-008",
      "category": "CAT-WEB",
      "category_title": "Web & Frontend Security",
      "priority": "SHOULD",
      "status": "PARTIAL",
      "in_scope": true,
      "requirement_text": "Set Referrer-Policy and Permissions-Policy response headers to limit information leakage and browser feature exposure",
      "title": "Missing Referrer/Permissions-Policy",
      "evidence": [
        {
          "file": "server.ts",
          "line": 189
        }
      ],
      "finding": "a feature-policy (payment) header is set (server.ts:189) but no Referrer-Policy and no modern Permissions-Policy",
      "risk": "referrer leakage and broad browser-feature exposure",
      "fix": "Add Referrer-Policy and a modern Permissions-Policy header (helmet), per the HTTP Headers cheat sheet.",
      "effort": "S",
      "url": "https://cheatsheetseries.owasp.org/cheatsheets/HTTP_Headers_Cheat_Sheet.html",
      "blueprint": {
        "id": "BP-SPA-BFF",
        "section": "Additional Security Headers",
        "url": "https://cheatsheetseries.owasp.org/cheatsheets/HTTP_Headers_Cheat_Sheet.html"
      }
    },
    {
      "id": "EH-001",
      "category": "CAT-EH",
      "category_title": "Error Handling & Security Events",
      "priority": "MUST",
      "status": "FAIL",
      "in_scope": true,